{"created_at":"2026-07-11T11:58:00Z","domains":[{"domain_id":"primary","role":"observer"}],"run_id":"run-10000000-0000-4000-8000-000000000001","scenario_id":"org.example.camera-stream","scenario_sha256":"9ed90d21bf272c4082211cbe42dc39fe0a7178b1a59d8b1a43bf93dc54acca3f","schema_version":"acceptance-run.v1","time_authority":{"kind":"sim_clock","source_id":"simulator-clock"}}
