{"created_at":"2026-07-11T11:58:00Z","domains":[{"domain_id":"control","role":"controller"},{"domain_id":"worker","role":"worker"}],"run_id":"run-00000000-0000-4000-8000-000000000001","scenario_id":"org.example.camera-stream","scenario_sha256":"9b1c47e35a72f456a04da6775816626e2baf26f134ab3c896b1176b55f51bef9","schema_version":"acceptance-run.v1","time_authority":{"kind":"sim_clock","source_id":"simulator-clock"}}
