{"created_at":"2026-07-26T10:00:00Z","domains":[{"domain_id":"controller-domain","role":"observer"}],"run_id":"run-41234567-89ab-4def-8123-456789abcdef","scenario_id":"org.example.controller-hil-observation","scenario_sha256":"6648c69bb1e0058c6ba233fa0003c7da4e1a4b898ef2aca543d2104ead133fab","schema_version":"acceptance-run.v1","time_authority":{"kind":"mavlink_timesync","source_id":"controller-clock"}}
